Stimulus,Description
729,"Pronounced Lily-Narcissus-like odor, someas a catalyst. what pungent and intense, but in proper dilution pleasant floral-oily-green Lily-Ylang-like."
730,"Floral and somewhat indolic.Narcisse-like odor with soft and oily-herbaceous undert ones, good tenacity."
731,"Very faint, delicately floral, sweet odor of considerable tenacity. Overall Lily-like, but mild enough to become a fixative background of other floral types, Oriental fragrances, etc."
732,"Metallic-green, Geranium-like, moderately tenacious odor, somewhat resembling that of Diphenyloxide, yet slightly sweeter, less “cool “’."
733,"Sweet, rather powerful floral, Narcissus-like odor of modest tenacity. The chacteristic difference between this material and the conventional Cananga-Narcisse-Lily chemicals lies mainly in the soft sweetness, the power of the ethylcarbonate without harshness, as compared to e. g. the ethylether."
734,"Very powerful Lily-Jasmin-Lilac type odor. The herbaceous and green notes are more pronounced in this ester than in the Acetate, and the overall odor impression bears some resemblance to Lilac and Jasmin."
735,"Mild, sweet-herbaceous. slightly green and oily odor with variable amounts of cresylic notes. most conceivably derived from impurities (decomposition ?)."
736,See also CREOSOTE
737,Lily -Narcissus-YlangYlang type odor.
738,"Rarely, if ever, offered commercially. This ester is the rarest and least useful of the three isomers."
739,"Very tenacious Lily-Hyacinth-Jonquil type odor. The nuances in odor occur when the material is not chemically pure, e. g. from traces of Phenylacetic acid"
740,"Very faint, sweet-floral odor of considerable tenacity. Reminiscent of Rose and Narcisse with emphasis on the green-woody undertones."
741,"Very faint floral-green, tenacious odor, reminiscent of Narcissus, Hyacinth, etc. but more delicate than the conventional para- Cresyl esters."
742,"Herbaceous-green, warm and somewhat tobacco-like or honeylike odor, yet not distinctly sweet, rather caramellic."
743,"Animal-floral odor, sometimes described as musky."
744,"Tobacco-like, animal, sweet-herbaceous odor with undertones resembling Civet."
745,"Soft, floral-green, almost herbaceous-green odor, not unlike the lower ‘.ca(binols” ( Dimethyl benzyl carbinol, etc. ) but overall sharper, lighter, fresher."
746,"This material is comparatively toxic, irritant and a pronounced Iachrymator. Its odor and flavor suggests a use similar to that of common (Allyl-)Mustard oil, and the material finds some use as a modifier of imitation Radish and Garlic flavors."
747,"Balsamic-herbaceous, warm odor of moderate tenacity."
748,"Warm, oily-herbaceous, winey odor of moderate tenacity."
749,"Warm and very sweet, Honey-Tobacco-like odor with warm, herbaceous undertones."
750,"Pungent, slightly green-sharp, kerosene-like odor of poor tenacity."
751,"When absolutely pure, the material is virtually odorless, but the scarce commercial lots have shown a distinctly herbaceous odor of considerable tenacity,"
752,"Oily-spicy odor, suggestive of Dillseed or Caraway, but not pungent or sharp like Carvone."
753,"Pungent, green-herbaceous odor with notes of animal and vegetable character at the same time. Generally described as “unpleasant” in high concentration. At concentrations well below 1% the odor appears more attractive, warm-spicy, still vegetable, condiment-picklelike."
754,"Mild, oily-green, herbaceous-winey odor."
755,"Herbaceous-sweet- very tenacious odor. In dilution reminiscent of Mandarin peel oil, but overall rather sharp and not as .’Orangeblossom”-- like as most of the conventional Schiff”s bases"
756,"Very faint, green-woody-spicy odor, resembling sap from wood, yet overall dry."
757,"Refreshing-herbaceous, sweet and delicately woody odor of moderate tenacity."
758,"Diffusive and powerful floral-green floralstem like odor with pronounced vegetable, Cucumber-Melon-like notes. Overall resembling the odor of Lindenblossom."
759,"Intensely sweet, fresh-floral odor of great tenacity, somewhat reminiscent of the flowers of the Lemon tree."
760,different odors.
761,"Powerful, and diffusive, foliage-green, “dark’’-weedy and dry odor, sometimes described as “’F1ower-shop odor”. The earthy and wet-g em notes are quite natural in high dilution and resemble the odor of stems from plants and flowers fresh from the soil."
762,"Mild floral-woody, somewhat oily-herbaceous odor, remotely reminiscent of Rose with similarity to the odor of hydrogenated Ionones."
763,"Sweet-woody, rather heavy odor, resembling that of bera-Ionone. More fruity than really floral, but not as tenacious as the Ionone,"
764,"Sweet herbaceous-woody, quite powerful odor with some resemblance to the odor of bera-Ionone. More diffusive, less tenacious, and not quite as floral."
765,"The odor varies according to isomer ratio, but can generally be classified as warm, Violetlike, sweet, yet somewhat powdery and very tenacious."
766,The odor of Ionones and their homologies is a subject generally avoided in written publications.
767,"Soft, floral, sweet odor of rather poor tenacity. In the author’s opinion, it is not nearly as useful as Geraniol, although it cannot be compared to Geraniol as any sort of a substitute "
768,"Rather minty, fresh and slightly green odor, reminiscent of that of Pulegol, but more Eucalyptus-like, cool, and not very floral. Diffusive and not very tenacious."
769,"Green-camphoraceous odor, both reminiscent of Ionones, but overall sharper, less sweet."
770,"Tenacious, woody-musky. but rather weak odor, not as sweet as Cyclopentadecanone, but more resembling Cyclohexadecanone."
771,"Tenacious animal, mostly musk-like odor, more woody and less sweet than Cyclopentadecanone (“Exahone”’ )."
772,"Rather sharp-acetic odor, not very characteristic."
773,"Bitter-almond-like, pungent odor with some resemblance to Nitrobenzene."
774,"Damp-earthy, camphoraceous-minty, Walnut- Vetiver-Oakmoss-like, relatively powerful odor of moderate tenacity"
775,Practically odorless.
776,Warm-camphoraceous odor.
777,"Powerful, mint y-camphoraceous, “cool” and “solvent-like” odor, generally described as “unpleasant” (by non-professionals)."
778,"Powerful and diffusive, somewhat gassyminty odor, often deseribed as “industrial” or “chemical”."
779,"Commercial grades of this ketone have an odor which is most often described as “Urinelike’”. It is somewhat ethereal, sweet-solventlike, Acetone-like in purer grade material."
780,"Refreshing green-floral odor of poor tenacity. Mild, yet quite diffusive, overall more sweet-floral than Cyclohexenyl acetaldehyde."
781,"Sweet-fruit y, but rather chemical odor. Often described as similar to Amylacetate, but the odor of Cyclohexyl acetate is sharper, less “candy-like”, less ““natural”’."
782,"Faint, fruity -Orangeblossom-type odor of good tenacity."
783,"Mild, faint, warm-balsamic, floral and somewhat herbaceous odor of good tenacity. The hcrbaceous notes appear as undertones barely perceptible except in compositions with other materials."
784,"Overall fruity, but has a nondescript floral note, remotely reminiscent of Phenoxyethyl isobutyrate. The Cyclohexyl butyratc is, however, much more powerful in its odor, and less tenacious."
785,"Powerful, sweet-fruity odor, more etherealdiffusive than Amyl acetate, sweeter, but overall resembling that esler in odor. The background appears almost Oriental-animal or Ambra-like."
786,"Fruity-winey, but somewhat “’metallic” odor of considerable tenacity. Overall resemblance to Pineapple-fruity odors"
787,"Sweet-balsamic, somewhat Almond-like and very tenacious odor. The “Almond-like” note resembles that of Heliotropyl esters with a touch of Bmtzaldehyde-note. The balsamic note resembles that of Benzyl cinnamate."
788,"Woody-camphoraceous, slightly minty and rosy odor, but overall dry and rather “chemical”."
789,"Herbaceous-minty, comparatively sweet odor, overall pleasant and of great tenacity"
790,"Woody-camphoraceous, faintly herbaceous, but rather dry odor."
791,Dry-camphoraceous odor with some (but not much) resemblance to Rose and Patchouli notes.
792,"Very slightly soluble in water, miscible with alcohol and oils. Sweet-fruity, fruit-preserverlike odor."
793,"Oily -herbaceous, grassy and slightly fatty, overall not very pleasant odor."
794,"Powerful and diffusive, refreshing, sweetfloral odor of poor tenacity. It has been classified as “nondescript” and it is true that the material has an odor which is difficult to describe, but it should not be understood as ‘“bland” or “mild”."
795,Pronounced fruity and somewhat floral (Jasmin) odor. Overall sweeter and more tenacious than Benzyl acetate.
796,"Musty-camphoraceous, slightly minty odor, remotely reminiscent of part of the Patchouli odor-picture."
797,"Delicately fruity, Pineapple-Apricot-like odor of good tenacity. Tealike, almost Clary Sage-like undertones."
798,"Fruity, slightly oily, bitter-sharp, rather pungent odor with a pleasant herbaceouswiney undertone."
799,"Fruity -herbaceous, berry-like, slightly camphoraceous odor reminiscent of notes in Geranium and Lavender."
800,"Almost odorless as such, but introduces a mild-herbaceous odor in compositions."
801,"Faint, but tenacious, oily-fruity odor with a green-winey undertone."
802,"Herbaceous-green, very tenacious odor with  sweet-honey-waxy and somewhat Chrysanthe- mum-like notes."
803,Very mild-balsamic. floral odor of moderate to poor tenacity.
804,"Very mild, sweet -balsamic, but rather “flat” odor of moderate to poor tenacity. It is less floral than Hydrocinnamic alcohol, and does not have the rosy character of that material"
805,"Intensely fruit y and sweet odor, somewhat reminiscent of Banana, Pineapple and Peach. Not very tenacious."
806,"Mild and agreeable, slightly fruity and sweet odor."
807,"Fruity, slightly animal, deep-herbaceous odor"
808,"Fruity odor, but less animal than that of the n-Valerate. Tenacious and sweet, more versatile than the n-Valerate."
809,"Powerful, sweet-Ambregis type odor of moderate to good tenacity."
810,"Weak, musky odor"
811,"Delicately animal, musky and sweet, extremely tenacious odor of outstanding uniformity."
812,"Musky, somewhat animal odor, much weaker than that of Cyclopentadecanolide."
813,"Powerful musky odor, very similar to that of MuScone (Methylcyclopentadecanone) and, in the opinion of many perfumers, superior in type and beauty."
814,"Diffusive, gassy, woody, musty odor. Genera[ ly described as unpleasant “industrial”."
815,"Powerful, sweet-herbaceous, diffusive odor of relatively poor tenacity. In high concentration rather gassy and not very pleasant, it develops sweet and agreeable notes upon dilution."
816,"Woody, rather dry odor. Only in extreme dilution will a musky odor appear clearly"
817,"Pleasant, mild-piney, camphoraceouswoody odor of moderate to poor tenacity."
818,"Miid, ethereal-piney, sweet-camphoraceous odor of moderate to poor tenacity."
819,"Commercial grades display a typical “gassy’’- kerosenlikeke odor, while highly purified material smells more citrusy, reminiscent of Lemon and Bergamot topnotes, having more freshness."
820,"Extremely powerful, Orange-1ike, sweet and fresh-citrusy odor, diffusive, yet quite tenacious. The Orange character is more attractive and natural at dilutions below 0.1 ~0, while higher concentrations display fatty-green notes."
821,"Fatty, but sweet and very tenacious odor with a pleasant fruity freshness in extreme dilution."
822,"Oily, but fresh and citrusy odor, somewhat reminiscent of Linalool, but overall of Orange- Bitter Orange, Grapefruit-character."
823,"Peculiar dry, musty, powerful odor, reminiscent of certain notes in Ambergris."
824,"Mild, sweet, slightly camphoraceous-woody, also warm and mildly spicy odor of fair tenacity. The odor has been compared to that of Dihydrocarveol, but such description does not help many perfumers,"
825,"Semi-dry, musty-woody odor with a remote resemblance to notes in Ambergris. However, the olfactory picture is very incomplete and the tenacity very poor - compared to Ambergris products."
826,"Sweet-fruity, slightly oily and floral odor of Jasmin type."
827,"Sweet-woody, musty and slightly green odor of moderate tenacity. The Sandalwood-like notes, for which this ester is still appreciated, appear most conspicuously in dilutions of less than 10% of this ester with significant amounts of mild, sweet and woody blenders."
828,"Refined, oily-peachy and extraordinarily tenacious odor. More Peach-like, less Nut-like than Nonanolide-1,4."
829,"Very powerful and very tenacious, sweet creamy, Nut-1ike odor with a heavy fruity undertone. The undiluted material displays a rather coumarinic sharpness in its topnote, but at concentrations of O.10; or lower, it seems to grow in volume, sweetness and oilycreamy softness."
830,"Semi-dry, tenacious odor resembling part of the Ambregris-picture, also woody, remotely reminiscent of Sandalwood. Odor variations are observed in materials from different sources of supply."
831,"Mild, sweet and faintly musky odor of considerable tenacity."
832,"Sweet and rather fresh, musky odor of good tenacity."
833,"Penetrating and very powerful, sweet-waxy, Orange-peel-like odor. In extreme dilution refreshing, Citrus-peel-like."
834,"Fresh-citrusy, green-oily odor with more or less pronounced aldehydic undertone, according to the chemical purity of the Acetal."
835,"Green-fruity, Citrus-waxy odor."
836,"Powerful odor, mainly of Orangeblossomtype, overall floral, but with perceptible notes from the parent materials. Very tenacious."
837,"Very faint, sweet-musty odor."
838,"Woody-camphoraceous, but also floral odor of good tenacity. The odor may appear sweet to some observers, rather dry to others. It is conceivable that the commercial material, only occasionally offered, is not a pure, single chemical."
839,"Powerful, somewhat musty-fatty, Walnutlike odor, with a vague resemblance to alifatic Aldehydes in its diffusive power and radiant odor."
840,"Rather unpleasant, sour-fatty, “rancid” odor."
841,"Sweet, slightly fatty-oily odor, waxy and floral, mainly rosy, also reminiscent of Lily and Orangeblossom, but fresher, in the same way as CitroneIlol is fresh."
842,"Very powerful, waxy-Orange-like, sweet- “aldehydic” odor of fair tenacity and high diffusive power."
843,"Powerful, waxy-harsh odor when undiluted, almost Stearin-like unpleasant fatty. Sweet, refreshingly fruit y and slightly oily-waxy"
844,"Powerful, fatty-oily, waxy-rosy odor of considerable tenacity. The rosy notes are particularly conspicuous in dilutions, best at 1% or lower, while higher concentrations bring about more waxy-oily notes."
845,"Powerful and very diffusive, fatty-buttey, oily-Nut-like odor of considerable tenacity. Sweeter and less fatty than Decalactone."
846,"Pleasant, oily-rosy, Rose-petal-like odor of considerable diffusive power and tenacity."
847,"Delicately floral-oily, sweet and slightly fruity odor with rosy overtones and ~soft, but tenacious Ambrette-seed-like background."
848,"Sweet fatty-fruity odor of Pineapple-Orange- like character, and rosy waxy undertones."
849,"Fresh-citrusy, rosy-sweet odor, somewhat reminiscent of Linalyl acetate, not quite as sweet, and rather fresher."
850,"Very tenacious, but comparatively mild, herbaceous-earthy odor with a musky note."
851,"Sweet, oily-fruity, Apricot-like taste with a slightly floral note. In spite of apparent power, its taste is rather bland, nondescript fruit>."
852,"Mild, oily-herbaceous odor of good tenacity"
853,Fresh-unctuous odor with undertones.
854,"Weak, oily, sweet-fatty, remotely fruity and very tenacious odor."
855,"Oily-herbaceous, sweet odor with some resemblance to Opopanax and Heracleum fruits"
856,"Almost odorless when pure, but is capable of introducing pleasant oily -herbaceous and very tenacious notes in compositions"
857,"Mild, oily-ethereal, faintly herbaceous odor of good tenacity."
858,"Faint, oily-rosy odor of considerable tenacity. The odor of the undiluted material is not really pleasant, but the effect of the Decylether in perfume compositions can be quite attractive."
859,"Light, fruity, almost sharp odor with floral, Honey suckle-Orangeblossom character. Its floral notes are accompanied by a heavy proportion of leafy, deep-green notes."
860,"Powerful, floral-green, very diffusive, yet tenacious odor, reminiscent of Rose petals, Lily, Muguet, Peony, etc., but overall greener than the straight florals."
861,"Very mild, oily-waxy odor. Virtually odorless when pure"
862,"Orange-like, oily-fruity, also floral andwiney, Grape-like odor of good tenacity."
863,"Mild, sweet and very tenacious floral odor, remotely reminiscent of Rose or Peony, but with somewhat herbaceous undertone."
864,"Fatty -aldehydic, musky, sweet and pleasant odor, somewhat reminismnt of certain notes in Ambrette seed."
865,"Warm-herbaceous, somewhat winey-caramellic odor of modest tenacity."
866,"Faint, fresh-oily odor. This could possibly be notes from traces of surplus Decanol in the ester."
867,"Ethereal, oily-fruity, faintly Apple-like odor, also reminiscent of the fatty notes in Pineapple."
868,"Refreshing, citrusy-waxy, light and floral (mainly rosy) fragrance of moderate tenacityj but good radiation."
869,"Very powerful, sweet, green-floral and somewhat tobacco-herbaceous odor of good tenacity. In extreme dilution reminiscent of the odor of Safran (Saffron)."
870,This chemical constitutes a trace impurity in commercial lots of synthetic Linalool
871,Mainly used as a solvent in flavor compositions. Practically no use in perfumery.
872,"Very powerful and diffusive, pungent, buttery odor. Chlorine-Quinone-like in high concentration, oily-buttery in extreme dilution."
873,used in flavors
874,"Pungent odor, not truly reminiscent of Garlic, but heavier, more “sulfide-like”, obnoxious odor."
875,"Pungent odor, reminiscent of Radish"
876,"Powerful, penetrating Garlic-Radish-like odor of poor tenacity. Not a lachrymator, but does produce some irritation of eyes and mucous membranes."
877,"Ethereal, but not winey, rather solvent-like, unnatural odor with sweet undertone of re-motely fruity character."
878,"Powerful and diffusive odor with peculiar dry-floral, almost tarry-medicinal odor in high concentration, pleasant floral and almost sweet in extreme dilution."
879,"Faint, sweet odor of Anisaldehyde character, but much weaker. Certain commercial lots have “Almond” odor,"
880,"Sweet, but rathtr faint, fruity -almondy odor of considerable tenacity"
881,"Swset, floral-animal, musky typs of odor wi:h good tsnacity, Harsher and less tenacious than .Musk Ambrette and Musk Ketone, but has an ov:rall resemblance to the Nitromusks."
882,Oilyj Coconut-buttery odor of considerable tenacity. In suitable dilution (best about 5 ppm in sweetened milk) it displays a pleasant creamy-Coconut-like taste.
883,It is described as having a Geranium-Rose type odor.
884,The above chemical is desmibsd as having a Geranium-Rose type odor with a Honeylike note
885,"Sweet-herbaceous, warm and fungoid, but pleasant odor of moderate tenacity."
886,"Oily fruily, somew hat harsh odor u ith some resemblance to Banana and Passionfruit."
887,pleasant Ambre-musky type of odor itself
888,Sweet Oakmoss-like penetrating odor with floral undertones.
889,"Fruity, but very mild and oily odor of considerable tenacity. To some people it appears vifiually odorless."
890,Very useful as a natural green topnote in Geranium and Violet bases.
891,"Oily-sweet, buttery taste, often with a slightly cheesy note."
892,"Sharp and pungent, fruity-buttery odor, sharper, fruitier and sweeter than that of the Di-n-butyryl, not as cheese-like."
893,"Extremely powerful, diffusive, gassy-fruity odor. In very high dilution pleasantly Applelike with a rose-like sweetness."
894,Penetrating and repulsive “Skunk” odor.
895,"Sweet, mild-aromatic, but rather “chemical” odor."
896,"Sweet ethereal odor of moderate to poor tenacity. Its fruity notes are pleasant, but not characteristic of any particular fruit."
897,"Very powerful and diffusive, fresh, vegetable-green odor, sometimes classified as “’Ozone-like”’ or Melon-like. Its odor has also been compared to that of fresh sap from wood or bark"
898,Sweet and rather mild Bitter-Almond type odor with herbaceous-haylike undertone.
899,"Green-floral, slightly oily and rather heavyodor of good tenacity."
900,"In any event, this chemical is included in the present work in order to describe one rare group of chemicals of possible interest to the perfumer."
901,"Camphoraceous-rosy, rather faint odor. overalI more crude and harsh than that of Citronellol."
902,"Quite powerful, fruity, Pear-like odor."
903,"This chemical serves mostly as a solvent for perfume materials, but it is not quite odorless and therefore not as desirable as Diethylphthalate. Toxic"
904,"Faint, ethereal odor with a musty undertone,"
905,"Faint, rather dry-musty, somewhat ethereal odor, not exactly pleasant."
906,"Very diffusive, sweet-ethereal odor. Actually a poor odorant, it gives impression of power by its very high vapor pressure at room temperature"
907,"Very faint, winey-ethereal odor."
908,"Mild, winey-fruity odor with a pleasant oily-herbaceous undertone, overall reminiscent of the odor of Apple skins (peel)."
909,Presumably not usedin perfume compositions.
910,"Sweet, soft and pleasant fruity-green, slightly balsamic odor, reminiscent of Apples."
911,"Pleasant, light, ethereal odor of good diffusive action and poor tenacity."
912,"Weak, somewhat musky odor, slightly herbaceous and Mushroom-like."
913,\’irtually odorless when pure
914,"Faint, but pleasant, winey-fruity odor, resembling that of Quince and Melon."
915,"Faint, pleasant odor, remotely winey-ethereal. The odor type is somewhat similar to that of Ethyl benzoate, but of much less power. Burning taste in high concentration, mildly tart-fruity upon dilution."
916,"Very faint, winey odor."
917,"Powerful and diffusive, sweet-herbaceous, caramellic odor of very poor tenacity"
918,"Powerful, repulsively sulfuraceous (sulfidelike) odor, only in extreme dilution becoming Company, Organic attractive, caramellic-burnt, “roasted” odor."
919,"Peculiar fatty “’wet wool” odor, with notes often described as “metallic”."
920,"Powerful “gassy’’-green, rat hcr choking odor, in high concentration almost cabbagelik~ but not sulfuraceous. At proper dilution, the odor has some similarity to the odor of Orange leaf (or Bitter Orange leaf water oil)."
921,"It has warm, herbaceous-winey, slightly green and quite tenacious odor of versatile use in perfumesy."
922,"Peculiar, wartn-herbaceous-floral odor with a woody undertone. The odor has sometimes been compared to that of the “Strawberrytree” (Mediterranean Arbutus), at other times it seems that the observer has great difficulties in describing the odor in common terms."
923,"Typical musky, sweet odor of great tenacity and fixative power. When compared to Ambrettolide, the DHA is less floral, somewhat weaker and lacks the radiant beauty of the.4mbrettolide. The animal notes are slightly more perceptible in the DHA, and it should not be considered as a cheaper replacement for .4mbrettolide."
924,"Sweet-herbaceous, quite powerful odor, less candylike and more dry, almost woody, as compared to Anethole. The overall impression is that of a ‘-clean” odor, not as “round” and “full”” as Anethole, yet overall ‘“anisic” of type."
925,"Very powerful, warm-spicy-herbaceous and sweet odor of excellent tenacity."
926,"The dexrro-isomer has a woody-floral odor, somewhat sickening-swmt, while the luevoisomer is rather unpleasant, slightly gassy, rather nauseating-animal, resembling the odor of Chenopodium (Wormseed) oil"
927,"Warm-herbaceous, powerful and diffusive odor, similar to that of laevo-Carvone, but slightly milder, less pungent, sweeter and in dilution less “’medicinal”."
928,"Sweet, slightly minty, floral, rosy odor with a herbal undertone."
929,"Peculiar dry-musty, almost Ambergris-like odor of excellent tenacity."
930,"Rather sharp, minty and “terpeney”’ odor, not exactly pleasant."
931,"Powerful, fresh-green lemony-sharp odor with a floral, Lime-like note."
932,"Fresh, rosy-green, foliage-type, slightly floral odor with ethereal notes"
933,"Faint, animal-musky odor, sweet, and slightly woody with good tenacity. Compared to Civettone. the DHC is considerably weaker and less characteristic “clean-animal-musky” in its overall performance."
934,"Sweet-herbaceous, nutlike, haylike odor, usually described as “coumannic” or “tobacco- like”."
935,"Warm-herbaceous, spicy odor, suggestive of Dill and Spearmint, but with a very diffusive and refreshing, almost fruity note"
936,"Woody-minty, sIightIy oiIy, but not very sweet taste. Very powerful."
937,"Powerful fatty-spicy, oily -herbaceous odor, reminiscent of Dill, Cumin and Gingergrass (green-oily, weedy notes)."
938,Practically odorless.
939,"Camphor-like, cool-herbaceous odor."
940,"Weak, woody-floral odor with camphoraceous undertone."
941,"Mild, oily-rosy, fruity and somewhat green odor. Much weaker than Geranylacetate, and not as Apple-like."
942,Mild and relatively sweet woody -piney odor of moderate tenacity.
943,"Refreshing light, woody-piney odor with mildly herbaceous-fruity undertones."
944,"Warm-spicy, sweet and slightly floral-balsamic odor, reminiscent of Eugenol, but milder and sweeter than this"
945,"Sweet and mildly floral odor with a soft, woody undertone and good tenacity. The odor is even milder than that of Famesol, and the tenacity is poorer."
946,not a well-defined perfume chemical.
947,"Woody and slightly floral odor, considerably weaker than the odor of alpha- and bera- Ionones."
