Stimulus,Description
2278,"Sweet, yet heavy, floral-musky odor of very good tenacity. The characteristic note of this Nitromusk is the floral tone of its muskiness."
2279,"Sweet and very tenacious musky odor with discrete animal note, less floral than Musk Ambrette, The characteristic note is the warm and mildly animal note. "
2280,"Intensely sweet, floral-musky odor"
2281,"Delicately sweet-musky, mildly, but unquestionably animal-like and very tenacious odor."
2282,"Sweet-musky and tenacious odor, rather harsh in its initial approach. This musk imparts sweetness but lacks the softness, floral or animal tonalities and overall power of the other Nitromusks."
2283,"Sweet-balsamic-resinous “gum” odor of poor tenacity. The odor of the purified Myrcene is refreshing, almost citrusy, but warmbalsamic, and ethereal-sweet"
2284,"Fresh, floral-Lime-like odor of moderate to poor tenacity. The Lime note is inevitably accompanied by woody notes, but should not show “piney” notes"
2285,"Fresh, diffusive, sweet citrusy-herbaceous odor of moderate to poor tenacity"
2286,"Fresh, green-citrusy odor with some resemblance to topnotes of Clary Sage oil. Moderate to poor tenacity"
2287,"Sweet and fruity-balsamic odor with a mild citrus note. The odor has striking resemblance to that of “canned pears”, and some observers even claim that they find the “metallic” note in it."
2288,"Very faint, waxy-oily odor, almost odorless when pure, but since the commercial material is often contaminated with traces of unsaturated acids, etc., an acid-rancid or acrid odor may occur in older material."
2289,"Very faint, Coconut-oily, mildly waxy odor of considerable tenacity. A highly purified product is almost odorless."
2290,"Very faint, fruity -citrusy odor with an Ambre-incense note, somewhat dry and moderately tenacious."
2291,"Pleasant and warm-balsamic, slightly woody odor of good tenacity. The undiluted material shows some “pepperiness”."
2292,"Very powerful, in dilution refreshingly citrusy, in concentration rather choking, pungent odor of considerable tenacity, and with an undertone of fresh Oakmoss."
2293,"Refreshing, spicy-herbaceous odor of Bayleaf-Cinnamon character. The diffusive warmth is particularly typical (and appreciated)."
2294,"Warm-herbaceous, slightly woody and discretely “medicinal”’-camphoraceous odor of moderate to poor tenacity. "
2295,"Pleasant, refreshing, sweet-herbaceous and very slightly spicy-warm odor of moderate tenacity."
2296,"Pungent, choking dry-tarry odor of moderate to poor tenacity."
2297,"Very mild, sweet-floral-balsamic odor of considerable tenacity."
2298,"Intensely sweet and tenacious, fruity-floralwiney odor. In extreme dilution, the fruity notes dominate and resemble (with reasonable imagination) Raspberry"
2299,"Sweet and fruity, very tenacious, delicately Neroli-Orangeblossom-floral odor."
2300,"Delicate and sweet, very tenacious floralfruity odor. Less fruity than the iso-Butylether, more Neroli-like in dilution"
2301,"Insoluble in water; soluble in alcohol and oils, poorly soluble in Propylene glycol. The volubility in alcohol is much better than that of the -methylether"
2302,"The odor of highly purified material is intensely sweet, Orangeblossom-Acacia-like, very tenacious, but many commercial grades are poorly refined and display rather harsh notes, an odor description generally used for this material."
2303,"Delicately sweet and tenacious, floral-balsamic odor of Neroli-Hyacinth-Narcisse type. There are notes in this complex of a pleasant fruity character, reminiscent of Apricot."
2304,"Very sweet and delicate fruity-floral odor of excellent tenacity. The floral notes are discretely neroli-like, while the fruity notes have a remote resemblance to Strawberry."
2305,"Intensely sweet, but unpleasant, almost choking odor. In high concentration it may remind the observer of Halogen-odor, and a great variety of phrases are used for description of its odor."
2306,"The result, often vew poorly purified, is a material with a rather harsh Orangeblossom odor. Much more dry than Methylanthranilate, and not nearly as versatile."
2307,"Very faint, woody-camphoraceous, musty odor"
2308,"Peculiar, dry-green, musty-medicinal odor with warm-herbaceous character. Good tenacity"
2309,The material is virtually odorless
2310,Practically odorless.
2311,Virtually odorless.
2312,
2313,"Refreshing Menthol type odor, but not quite as sweet as Menthol"
2314,Warm-spicy and very tenacious odor with an almost choking sweetness often classified as “nauseating”.
2315,"Sweet rosy, refreshing and “wet” seashore odor of moderate tenacity"
2316,"Mild and delicately woody-floral, slightly green odor with remote resemblance to Apple and Lily"
2317,"Sweet-woody, tenacious and mildly greenrefreshing odor"
2318,"Very sweet, fruity-woody, Bergamot-and-Pear-like, but delicate and very tenacious odor"
2319,"Delicately woody, rather dry, but refined and discrete odor of moderate to good tenacity. It has a touch of floral note which, combined with the woody and green traces make this material almost “confined” to Muguet."
2320,"Fresh, but rather dry, delicately woody, remotely Pear-like odor of pleasant softness and good tenacity"
2321,"Warm and bitter-sweet, green-floral, woody-Ieafy odor of moderate tenacity. The undertones are warm, almost Honey-like."
2322,"Very sweet, fruity-floral odor of Raspberry-Rose character, refreshing and moderately tenacious."
2323,"Very mild, floral-balsamic and slightly “metallic “-fresh odor, sometimes described as “green”. Excellent tenacity."
2324,"Delicate, leafy-floral, fruity Orange-like and very sweet odor of rrtoderate tenacity."
2325,"Very delicate, refreshingly floral-sweet and warm odor of moderate to good tenacity"
2326,"Refreshing, sweet-rosy or fruity-herbaceous odor with emphasis on the fruity (fruit-preserve)-notes, and less floral than the lower esters of Nerol"
2327,"Refreshing herbaceous-green and floral, delicately rosy (like hedgerose) odor of moderate tenacity."
2328,"Deep-sweet, very rich, but mild-rosy-honeylike, floral odor of considerable tenacity. The undertones may be ruined by a surplus of Phenylacetic acid if such is present."
2329,"Sweet and very fruity, “jam-like” odor reminiscent of the heavy syrup of fruit preserves, yet with a trace of fresh-floral notes and moderate tenacity."
2330,"Powerful and rich, sweet-herbaceous and fruity odor of good tenacity"
2331,"Rich and sweet-herbaceous, Clary Sage and Hop-type odor with ethereal-fruity notes and good tenacity"
2332,"Pungent and harsh or offensive, Bitteralmond type odor of poor tenacity."
2333,"Pungent, but sweet herbaceous-green odor of moderate to poor tenacity."
2334,"Peculiar, but intensely sweet and pungentherbaceous odor, displaying a complex of green, anisic, almondy and woody -herbaceous notes."
2335,"Warm-medicinal, sweet “phenolic’’-tarry odor of considerable tenacity."
2336,"Sweet-floral, warm-spicy and moderately tenacious odor, often described as resembling Cinnamon."
2337,Pungent-sweet herbaceous-spicy odor with resemblance to Bitter-almond and remote similarity to Heliotropine. Good tenacity
2338,"Pungent, but very sweet, heavy odor, sweeter than that of Nitrobenzene, and not as offensive. Moderate to poor tenacity"
2339,"Extremely powerful and ve “y diffusive green-vegetable odor, only in dilution reminiscent (strikingly) of Cucumber or Violet leaf"
2340,"Powerful, fresh-green Cucumber odor, less oily and, in proper dilution, much fresher and lighter than the odor of the aldehyde itself"
2341,"Extremely powerful and very diffusive oily -green, herbaceous and, in proper dilution, sweet, pleasant leafy-vegetable odor of moderate to poor tenacity"
2342,"Very powerful, fatty-oily, but rich and sweet, mildly nut-like odor of excellent tenacity."
2343,"Very powerful and diffusive fatty-floral, waxy odor of moderate tenacity. In proper dilution, the fatty notes become more pleasant, floral-waxy, more rosy and sweet, fresh as Neroli."
2344,"Delicately green-oily, mildly herbaceousfloral odor of good tenacity."
2345,"Refreshing and relatively powerful citrusyfloral, oily-green odor of moderate tenacity"
2346,"Powerful, oily-herbaceous, warm odor of moderate tenacity. Considerable variations are observed when studying the various brands. Notes of floral-Jasmin character, mushroom-like Lavender character or almost caramellic sweetness may be present, predominant or absent in one or the other specialty."
2347,"The pure chemical has a mildly nut-like, fatty and acid odor of good tenacity."
2348,"Powerful, oily-floral, fresh and “petal’’-like odor, rather fatty when undiluted, light and almost rosy when highly diluted"
2349,"Herbaceous, mildly spicy-earthy, but overall sweet and oily odor of moderate to poor tenacity. The odor is not floral like the 1-Nonanol, and not “mushroomy” like- Vinyl hexyl carbinol."
2350,"Creamy, coconutty, delicately fruity (in extreme dilution) and floral-musky odor of excellent tenacity."
2351,"Powerful and, when undiluted, somewhat sharp or pungent grassy-herbal odor with green-fruity undertones. Upon dilution the herbal notes become more natural-sweet, mildly oily, remotely mushroomy-earthy, warm."
2352,"Herbaceous-fruity, warm-ethereal odor of moderate tenacity."
2353,Practically odorless.
2354,"Refreshing, fruity-floral odor with a drywaxy, pleasant note and moderate tenacity."
2355,"Practically odorless when pure, but causes a violently burning taste sensation, even at very low concentration"
2356,"Extremely powerful and diffusive, penetrating, fatty-orrisy odor in higher concentrations. In dilutions below 0.1 !4 the odor becomes more Orris-like, waxy, less fi!itty, slightly green and in extreme dilutions quite pleasant"
2357,"Powerful and very diffusive, waxy-floral odor with balsamic-nutty note and moderate tenacity."
2358,"Powerful, refreshing, green-oily, herbaceous odor of moderate to poor tenacity"
2359,"Powerful, earthy-herbaceous, in dilution refreshingly spicy-herbal odor of moderate tenacity."
2360,"Vegetable-green, mildly oily -herbaceous odor of considerable tenacity. The odor is sometimes described as resembling Artichoke"
2361,"Faint, but pleasant, warm-woody-herbal odor with some resemblance to Ambregris. Excellent tenacity but rather poor stability."
2362,"less waxyfatty, more sharp-pungent than that of the aldehyde."
2363,"Powerful fruity-green, leafy and mildly earthy odor of moderate to poor tenacity"
2364,"Fruity, but also heavy-herbaceous, “incense-like” odor with mildly green-earthy, Reseda-like notes"
2365,"Very sweet, yet refreshingly “peel-like” Mandarin-Orange type odor with distinctly Orangeblossom-winey-fruity undertones and excellent tenacity."
2366,"Peculiar, warm-herbaceous, sweet-fruit y odor complex of considerable tenacity."
2367,"Heavy, sweet-fruity Orange-Rose, yet herbaceous odor of moderate tenacity"
2368,"Delicately fruity, not as “deep” as the nbutyrate, yet a sweet-sharp Apricot-like, Orange-rosy, herbaceous-green odor of moderate tenacity."
2369,"Floral, mildly Coconut-Peach-like odor with musky undertone and excellent tenacity."
2370,"Weak, fatty-grassy oily odor with mildly musky undertone and excellent tenacity."
2371,"Winey-ethereal, mildly fruity and nut-like odor of moderate tenacity."
2372,"peculiar sweet-rosy, delicately earthyoily odor"
2373,"Mild, but persistent woody-musky and soft-floral odor."
2374,"Refreshingly fruity-citrusy, sweet and lightly floral odor of moderate to poor tenacity."
2375,"Mildly green-herbaceous, sweet, Rose- Orangeblossom type odor of moderate tenacity."
2376,"Pungent-herbaceous-ethereal, but sweet and warm odor of moderate to poor tenacity."
2377,"Mild-fruity, oily-Orange-like odor of “aldehydic” character, but overall weak"
2378,"Winey-ethereal, sweet-rosy and mildly waxyaldehydic odor of moderate tenacity"
2379,"Warm-fruity, slightly musty-floral odor with some resemblance toHazelnut. Moderate tenacity."
2380,"Heavy-fruity, Apple-and-Hazelnut-like odor with citrus-winey notes. Moderate tenacity"
2381,"Powerful, sweet-green, diffusive odor of moderate to poor tenacity. Various specialties of widely diiTerent composition and odor have been available of above or related identity."
2382,"The title material has an extremely powerful fruity, sweet and citrusy odor of good tenacity"
2383,"Very mild, woody-camphoraceous odor of moderate to poor tenacity"
2384,"Sweet, woody-fruity odor of moderate tenacity. Some similarity to Linalylacetate, however, less sweet, less fruity, more woody. Arefined grade of Nopyl acetate shows more sweetness, less woody-piney odor"
2385,"Sweet, but rather heavy, warm-herbaceous, almost spicy-balsamic odor of moderate tenacity."
2386,"Warm-herbaceous, mildly spicy odor of moderate tenacity"
2387,"Very diffusive, gassy-piney, camphoraceouswoody odor"
2388,"Warm-herbaceous, very diffusive odor of poor tenacity. The sweetness is almost floral, and there is an immediate similarity to Neroli oil in the odor of pure Ocimene."
2389,Diffusive and refreshing camphoraceous- Lime-1ike odor with an undertone of floral OH sweetness
2390,"Its fruity notes resemble the odor of Bartlettpear (preserved) and the material showsgreat versatility in use. As a modifier for alltypes of herbaceous fragrances, includingClary Sage, and in combination with Oakmossand Styrax it gives new and attractive tonalities and pleasant freshness."
2391,"Very faint, waxy, tenacious odor. Pure material is free from any trace of harsh or rancid notes."
2392,"Virtually odorless when pure, but commercial grades normally have a faint, blandoily odor"
2393,"Powerful and penetrating green-vegetable, grassy and somewhat fatty odor of moderate to poor tenacity."
2394,"Powerful and very diffusive, sweet-oily, almost creamy-buttery, yet green and vegetablelike odor of moderate to poor tenacity."
2395,"Powerful Coconut-coumarinic odor with herbaceous-spicy, almost Caraway-like and warm notes. Slightly greener, but less fatty than the n-Butyl butyrolactone, also more Caraway-like."
2396,"Minty-musty, camphoraceous odor of moderate tenacity"
2397,"Powerful, and in undiluted state harshfatty, penetrating odor. In extreme dilution sweet, Orange-like, slightly fatty, Honey-like and of moderate to poor tenacity."
2398,"When absolutely free from aldehyde, this material has a pleasant sweet-woody, green and mildly floral odor, often including a winey or ethereal topnote."
2399,Powerful oily-green and waxy-citrusy odor of poor tenacity.
2400,"Oily-rancid, sweat-like odor, repulsive to most people, even in dilution of less than 0.1 % acid."
2401,"Powerful, fresh, Orange-Rose-like, waxy and sweet odor of poor tenacity. Balsamicherbal undertones are often classified as Opopanax- like."
2402,"Sweet and powerfully herbaceous, oilynutty and warm odor"
2403,Sweet-herbaceous Coconut-like odor with an oily Tonka-bean-like undertone.
2404,"Powerful, herbaceous-fruity, mildly spicy odor of moderate tenacity"
2405,"Fruity-floral and herbaceous odorcomplex. The fruity notes being of Apple citrus character the floral-herbaceous notes resembling part of Jasmin, while the earthy-herbaceous undertones point in the Foug&e direction"
2406,"Refreshing and rather delicate, rosy-minty odor of moderate to poor tenacity."
2407,"Relatively powerful, oily-musty odor, in dilution more fruity and pleasant. Moderate to good tenacity, but unpleasant when undiluted."
2408,"Fruity, slightly fatty, waxy-floral odor with a discretely green, Apple-1ike or almost “weedy” note, while the undertones are mildly woody."
2409,"Fresh-oily, herbaceous-floral and very sweet, tenacious odor of Sweet-Pea and NeroIi-type, often compared to “Frangipanni”"
2410,"Rather weak, balsamic-oily odor of considerable tenacitv."
2411,"Peculiar, green-herbaceous, remotely Orange-like and mildly fatty-floral odor. The herbaceous notes resemble the warmer parts of Galbanum, while the floral notes are related to Rose. Moderate tenacity."
2412,"Refreshing, herbaceous and fruity-green, vegetable odor."
2413,"Fruity-rosy, floral and fresh odor of moder-ate to good tenacity. Fresher odor than that of the n-Butyrate. The fruity notes being light Melon-Peach-like."
2414,"Very tenacious, but delicately green-peachy odor with unquestionably musky undertones."
2415,"Bland-fruity, also mildly herbaceous odor of considerable tenacity. The odor seems to lack character, and its initial power is very limited. Only in composition with more vola-tile materials it may show some effect, generally fruity, Banana-like and mildly green or almost “metallic” as Parsley."
2416,"Weak, but persistent and sweet-herbaceous, almost tea-like odor "
2417,"Very mild, but sweet and tenacious, balsamic odor. The sweetness is more herbaceous- spicy than fruity, and it is often described as Opopanax-like."
2418,"When this material is absolutely pure, it is virtually odorless"
2419,"Mild, oily-woody, almost floral odor of considerable tenacity. The undiluted material may appear somewhat camphoraceous, but its effect is rather sweet and floral-woody in compositions."
2420,"Sweet and oily-floral, mildly balsamic-herbaceous odor of excellent tenacity."
2421,"Sweet-ethereal, diffusive odor."
2422,"In flavors, the ester finds its way into “tutti- -frutti” compositions, Peach and Apricot imitations and various Citrus types."
2423,"Very faint, sweet-oily, herbaceous-caramellic odor of considerable tenacity."
2424,"Mild, balsamic-sweet and remotely fruity odor of considerable tenacity."
2425,"Oily-green, mildly leafy and somewhat fatty odor of considerable tenacity. Less Violet-leaf- Iike than the lower homologies of these esters."
2426,"Oily-fruity, mildly green and fresh odor resembling the odor of unripe fruit. The oily notes are sweet and rather pleasant"
2427,"Sweet and oily-herbaceous, slightly fruity odor of moderate tenacity."
2428,"Floral and fruity, rather heavy and power-ful, Jasmin-like, warm and discretely spicy odor of moderate tenacity"
2429,"When absolutely pure, the ester is virtually odorless, but commercial samples have usually shown some degree of oily-fatty or blandfruity odor."
2430,"Powerful oily-green odor, sweet and green floral in dilution, the oily notes being freshnut-like, the green notes sweet, vegetable-like, with moderate tenacity."
2431,"Peculiar earthy-floral, and oily citrusy odor of excellent tenacity."
2432,"faint, dry-medicinal odor, but not as choking or distinctly “phenolic” as that of Phenol or Cresol"
2433,"Mild, but very tenacious, sweet-floral odor of woody-Orange-Rose type. The Orange character seems to come from oily-sweet notes which may be concealed under Rose-honey notes if the ester is poorly balanced ("
2434,"Oily-herbaceous, slightly earthy-woody and sweet-spicy odor of considerable tenacity."
2435,"Sweet, oily-waxy and fruity-herbaceous odor, overall a relatively pleasant complex with many notes resembling food or condiment products."
2436,Practically odorless when pure.
2437,"Fruity and relatively diffusive, Apple-Banana-like odor with fresh-’’aldehydic” notes and moderate tenacity."
2438,"Powerful, fatty-fruity, herbaceous odor of moderate tenacity. The herbaceous notes are rather heavy, almost spicy, and the terminal notes are “powdery” resembling the dryout of root-like odors."
2439,"Yet, it is not as “gassy” as the Styrene family, and not as ‘“gasoline’’-like as the Olefins or Paraffins. It is ethereal and sweet, of very poor tenacity, warm and remotely resembling the odor of Myrcene in its warm spiciness."
2440,"materials have a faint, bland-oily odor"
2441,"Warm and sweet, nut-like, earthy-mossy odor of moderate tenacity."
2442,"Dry-woody-tarry, also Walnut-like odor of good tenacity."
2443,"Sweet, soft and extremely tenacious, discretely animal-musky odor"
2444,exquisite musk odor with a pleasant note resembling Ambrette-seed oil
2445,"Sweet, tenacious and intensely musky odor. Generally considered less powerful and less tenacious than Cyclopentadecanolide, and it does not have the attractive and highly appreciated “Ambrette-seed “-like note"
2446,"Sweet and woody-floral, delicately green odor of good tenacity. The overall odor bears some resemblance to that of Cyclamen aldehyde."
2447,Virtually odorless when absolutely pure.
2448,"Powerful, floral-green, sweet and Violetleaf-like odor of moderate to poor tenacity."
2449,"Very faint, but delicately fresh-floral odor of good tenacity,"
2450,"Very faint, bland-waxy and discretely floral odor of excellent tenacity. An absolutely pure material is reported to be virtually odorless."
2451,"Faint, but sweet and delicate, etherealwiney, oily odor, Good tenacity."
2452,"rarely used in perfume compositions, Higher concentrations have acrid taste and repulsively acid odor, pungent and irritating."
2453,Powerful and pungent Mustard-like odor of poor tenacity.
2454,"This alcohol has been used in perfume compositions as part of leafy-green topnotes, as a “lifting” ingredient, and in combination with Galbanum, Geranium and similar materials for powerful effects"
2455,"Powerful and diffusive, green-fruity, somewhat pungent odor of poor tenacity. The fruitiness resembles that of Amyl acetate, but it is not nearly as sweet, the greenness is slightly gassy-leafy, Violet-like."
2456,"Woody and faintly citrusy odor with some resemblance to the odor of the Ionones, but inferior tenacity."
2457,"Warm and slightly spicy, Jasmin-like odor of excellent tenacity. Not as sweet as iso- Jasmone, but also less Celery-like in its warmspicy character. Overall less floral than the most popular iso-Jasmones and Didydro jasmones, etc."
2458,"Powerful, but not pungent, green-herbaceous odor of spicy-condiment-like type. The odor is often classified as “resembling that of Cuminaldehyde”,"
2459,"When absolutely pure, the material has a pleasant, fresh-citrusy and peppery-woody odor with a discretely minty note."
2460,"Peppery -minty, refreshing and slightly citrusy odor of poor tenacity."
2461,"Powerful, sweet-green, tenacious odor"
2462,"Peppery -minty, refreshing and slightly citrusy odor of poor tenacity."
2463,"This material has been suggested for use in perfume compositions as a modifier in .’green” and green-floral notes, particularly interest ing in Lilac and Muguet."
2464,"Very faint, acetic-sweet odor of considerable tenacity. The odor is not nearly as cloying as that of Phenylacetic acid, and not as Honey-like, but it is more ““sour”."
2465,Sweet floral odor of good tenacity.
2466,"Sweet-fruity, rosy-floral, slightly honey-like odor of excellent tenacity. Good perfumery grades should show no “metallic” note, generally due to the presence of Glycol-impurities."
2467,"Warm, rosy-fruity, slightly earthy-herbaceous odor of good tenacity. Not as sweet as the iso-butyrate, but warmer."
2468,"Warm-fruity-floral odor of considerable tenacity. The tobacco-like notes seem to re-monophenylplace the honey-notes (in the lower esters), and the fruity theme is discretely Apple-like. The odor is not as herbaceous-fungoid as that of the propionate, but not as warm either."
2469,"Sweet, mild-fruity-honey-like, tenacious odor."
2470,"Very powerful and penetrating, pungentgreen, floral and sweet odor of Hyacinth-type."
2471,"Sweet-floral, somewhat earthy-fruity odor of good tenacity."
2472,"Sweet and delicately green-rosy, floral, tenacious odor."
2473,"Sweet and very tenacious, floral-honey-like odor."
2474,"Intensive, pungent-green odor, reminiscent of cut grass"
2475,"Herbaceous-green, but not very pleasant odor of moderate tenacity."
2476,"Mild, yet rather heavy-floral, sweet and tenacious odor."
2477,"Sweet-floral, delicately green, refreshing odor of good tenacity."
2478,"Mild and sweet-floral, slightly green and very tenacious odor."
2479,"Sweet-foliage-like, intensively green and moderately tenacious odor. More refined or delicate, less pungent-green than the Dimethylacetal."
2480,"Deep-sweet, heavy and rosy-herbaceous, slightly earthy odor of very good tenacity."
2481,"Earthy-green, pungent floral odor of moderate to poor tenacity"
2482,"Sweet-earthy, green-floral Hyacinth type odor."
2483,"Sweet-green, warm-earthy odor of moderate tenacity. The green-earthy complex is generally  classified as “Reseda’’-like, which is highly appreciated in perfumery, ah bough very few perfumers know what Reseda smells like "
2484,"Fresh-rosy, floral and sweet-green odor of moderate to poor tenacity"
2485,"Powerful green-earthy, flower-stem-like odor, not as pungent as that of the aldehyde,"
2486,"Slightly musty, green-herbaceous odor of moderate to poor tenacity"
2487,"Clean and mild, fresh-rosy, leafy odor of moderate to poor tenacity"
2488,"Very faint, sweet-green, rosy odor with peculiar semi-dry undertones. Moderate to good tenacity."
2489,"Slightly green-woody, very mild and delicate odor of moderate tenacity."
2490,"Peculiar oily-green, earthy -rooty, but mild and sweet odor of good tenacity."
2491,"Floral, but somewhat harsh odor of Lily-Jasmin type. Impure products may show phenolic notes, while a “metallic” note seems to be normal in this material."
2492,"Sweet, animal-honey-like odor of extraordinary tenacity. The sweet-honey-like character is predominant at very low concentration, while the animal-Civet-like notes appear at higher concentrations."
2493,"Faint, balsamic odor of excellent tenacity."
2494,Very faint “metallic’’-sweet odor
2495,"Sweet and fruity-honey-like, relatively tenacious odor with discrete balsamic-floral character."
2496,"Warm, spicy-floral and balsamic odor,"
2497,"Ethereal-rosy, green, slightly “gassy”, Geranium- type odor of poor tenacity"
2498,"Light and sweet-herbaceous odor with discretely citrusy-lemony notes, overall resembling Verbena, although not nearly as “lemony”."
2499,"Very’ faint, sweet-floral odor of blossom-Honeysuckle type."
