Stimulus,Description
1,"The pure material is virtually odorless. The commercial material has a faint, pleasant-resinous odor."
2,"Very faint, woody and slightly piney odor."
3,"Pungent ethereal-nauseating odor, in high dilution reminiscent of Coffee or Wine."
4,"Mild, sweet, slightly green-fruity odor."
5,"Mild, oily-green, somewhat vegetable odor."
6,"Agreeable, refreshing, fruity-green odor."
7,"Powerful, oily-green odor with a sweet, vegetable-like undertone."
8,"Mild, somewhat sweet-floral odor."
9,"Strong, ethereal-winey odor."
10,"Powerful green, herbaceous-vegetable, oily odor, reminiscent of many natural products."
11,"Pleasant, but weak floral odor, suggestive of Rose and Jasmin, with undertones of greenearthy, herbaceous character."
12,"Powerful, ethereal, green-herbal and leafy odor and very natural character."
13,"Sweet, but somewhat harsh, haylike odor with floral-animal notes. Suggestive of Hawthorne, Mimosa, Heliotrope, etc"
14,"Mild and sweet-spicy, balsamic-fruity odor, reminiscent of carnation. Earthy-fresh notes, or leafy-floral notes not uncommon"
15,"Fruity-balsamic, warm and faintly spicy odor, somewhat clove-like, but with rosy floral notes and vanilla-like sweetness"
16,"Pungent, stinging sour odor, unpleasant when concentrated, less repulsive when diluted below} 15$0 in water."
17,"Powerful, dry-herbaceous, woody-orrisy odor, remotely reminiscent of cuminic derivatives."
18,"Light ethereal-nauseating and powerful odor of very poor tenacity. Irritant at high concentration, rather pleasant in dilution"
19,Ethereal-camphorlike odor.
20,Ethereal odor
21,"Agreeable odor, mild and reminiscent of Bitter Almond oil, but less pronounced than But yronitrile."
22,"Pleasant, sweet-ethereal odor."
23,"warm-spicy odor, reminiscent of breadcrust, burnt caramel, etc. with a fruity-floral, sweet note in extreme dilution."
24,"Pungent-sweet odor, in dilution resembling that of hawthorn or is harsh orange-blossom type. The effect in perfumes is generally a flowery one, coumarin-like, warm, slightly animal, powerful."
25,"Warm, green-spicy, somewhat floral odor, varying according to the chemical purity of the product."
26,"Heavy, sweet-floral, somewhat animal odor. The odor picture varies according to the quality of the reaction product."
27,its general toxicity would decrease or possibly prevent its use in perfumes and flavors.
28,"Very faint, sweet odor, remotely reminiscent of Vanillin, but less spicy, somewhat fresher."
29,"Ethereal-minty odor, somewhat metallic or “’chemical”. In high dilution, the flavor in aqueous medium is sweet, remotely reminiscent of Peppermint sweetness."
30,"Mild, sweet-musky odor with a faint, animal undertone and good tenacity."
31,"Powerful, creamy-sweet, heavy-buttery, oily odor, yet somewhat milder than Diacetyl"
32,"Heavy creamy-sweet, fruit y-buttev odor, often described as “quinone-like”. Less buttery, more fruity than the normal ketone"
33,"Powerful and sweet, oily-buttery odor with herbaceous-cheesy undenone, yet not rancid or unpleasant in dilution"
34,"Pungent, sweet-caramellic, somewhat choking- ethereal odor."
35,"Peculiar fruity-buttery, somewhat sour odor."
36,Peculiar camphoraceous-sweet odor with a certain amount of floral tones
37,"Camphoraceous, minty-herbaceous, also somewhat floral odor."
38,"Peculiar, warm-woody, somewhat herbaceous odor, reminiscent of Tobacco leaves (cured)."
39,"Powerful bakamic-sweet odor with a tobacco- like, almost narcotic pungency. Floral undertones are of balsamic-cinnamic character."
40,"Sweet-musky, somewhat animal and slightly sour-sweaty odor of great tenacity."
41,Sweet woody-musky odor of considerable tenacity.
42,"Peculiar, strong and persistent odor, simultaneously non-floral and heavy-sweet-floral. Not nearly as pungent as Acetophenone, but still rather chemical in its general character."
43,"Intensely creamy-fatty-buttery, penetrating odor, yet milder and less “quinone’’-like than Diacetyl, not as sharp or volatile. Pleasant in extreme dilution."
44,"When pure and dry, almost odorless."
45,"Oily-buttery odor, pungent and somewhat “quinone’’-like, less sharp and volatile than Diacetyl."
46,"Powerful, almost choking, Cigar-tobaccotype odor, which becomes pleasant only at extreme dilution, then also more typical tobacco-like."
47,"Powerful, diffusive, buttery and slightly animal, quinone-like odor, pungent and cheesy, but sweet in its oily character."
48,"Powerful oily-buttery, somewhat fruity odor"
49,"Mild and sweet, floral-Vanilla4ike odor of good tenacity. Fresher than the odor of Vanillin, but lacks the warmth of Vanilla and Vanillin."
50,The latter material has very little odor and is of no substantial use to the perfumer
51,Practically odorless
52,"Pungent, irritating odor (A. is a lachrymator), unbearable to human mucous membranes or eyes."
53,"Its odor resembles that of acetic acid, but it is more acrid, corrosive to human mucous membranes, irritating to the eyes."
54,Practically odorless. 
55,"Peculiar sweet-medicinal odor, reminiscent of Anise, Estragon, etc. with a herbaceousminty note, quite tenacious."
56,"Peculiar sweet-minty, slightly woody odor, faint but tenacious."
57,"Powerful, heavy-sweet, somewhat floral odor, resembling that of Heliotropine."
58,"Pungent, herbaceous-oily and heavy-sweet odor of considerable tenacity and displaying a gamut of “natural” odors."
59,"Diffusive, fresh-gassy, herbaceous odor. The gassy notes are more predominant in poorer grades of Allo-ocimene, almost im-perceptible in good grade mat]."
60,"Sweet, woody-caramellic, rather mild odor of Furan-type, the woody notes resembling the odor of sawdust."
61,"Musky odor of considerable tenacity, but low odor level"
62,"Very faint, but tenacious sweet-woody odor with some resemblance to Cedarwood. Trace of animal notes."
63,"Ethereal-winey odor, somewhat similar to that of Ethyl acetate, but more pungent, rumlike, fruity, arak-like."
64,"Sharp-fruity, very heavy balsamic-grapelike, sweet odor with a somewhat green topnote."
65,"Weak, but pleasant berry-like, fruity odor with some cherry caracter"
66,Sweet-ethereal odor with somewhat fruity undertone.
67,"Fruity odor, somewhat Peach-Apricot-like, also resembling Apple."
68,"Musky -herbaceous, heavy odor, reminiscent of Cumin, Angelica, Mintleaf."
69,"Banana-Pineapple type odor, somewhat fatty- sweet and powerful without being pungent."
70,"Slightly pungent, fatty-fruity odor reminis-cent of Pineapple, Rum, Arak, remotely of Peach. Less ethereal, but more natural Pine-apple-like than Methyl caproate"
71,"Powerful fruity, slightly fatty Banana-Pineapple like odor with a somewhat oily-winey undertone."
72,"Weak, but tenacious Peach-Apricot type odor, winey, balsamic and somewhat Styrax like"
73,"Onionlike, but pleasant and rather sweet, not pungent"
74,"Pronounced “mixed-fruit y“ odor, sweet, lasting and less ethereal than the lower aliphatic acetates."
75,"“Mixed-fruity” odor of somewhat fatty character, quite tenacious."
76,"Rather weak, fatty-fruity odor of considerable tenacity."
77,Powerful and sweet-fruity odor resembling Pineapple. Smoother and sweeter than Allyl caproate. Fruitiness similar to that of Linalylacetate.
78,"Heavy, sweet. mixed-fruity odor of great tenacity."
79,"Peculiar oily-fruity odor, nondescript fruit type."
80,Sweet and fruity odor without having characteristics of any specific type of fruit.
81,"Ethereal-fruity odor, slightly pungent and, in moist atmosphere, reminiscent of Mustard."
82,"Peculiar sweet-musty, fungal, Champignonlike odor."
83,"Caramellic-fruity odor, often classified as “’jam-like” or “cooked-preserve-like”, reminiscent of canned, syrypy fruit,"
84,"Very powerful, but quite natural and not very pungent green-leafy, violet-leafy odor, typical ‘foliage” odor, less gassy than the Methyl ester."
85,"Sweet-fruity, somewhat pungent, vinous Banana-like odor."
86,"Oily-sweet, slightly flowery, but also fruity, woody and bark-like green odor of considerable tenacity."
87,"Penetrating and extremely diffusive onion-like, but sweet and not really pungent odor."
88,"Fruity -winey, somewhat fatty-oily odor, resembling that of wine residue, cognac residue or the like. A trace of sharpness in the fruity notes resembles Pineapple."
89,"Fatty and slightly nutty, green-fruity, somewhat Pineapple-1ike odor."
90,"Weak, anisic, sweet odor, more pungent than Anethole, less sweet or mild."
91,"Somewhat sharp, mixed-fruity, mainly Pineapple- like and honey-sweet odor of great tenacity."
92,"Sweet honeylike, but faint odor with sweetfruity undertones and good tenacity. Less floral than the Phenoxy+ster."
93,"Somewhat sharp, sour-fruity odor, suggest - ive of Apple and Apricot"
94,"Powerful onionlike-garlic-like odor. Not pungent, more garlic-like than oniorrlike"
95,"Sweet-woody odor reminiscent of Ionones, Cedarwood and Vetiver, quite pleasant and fairly tenacious."
96,"Peculiar herbaceous-fruity odor, softer than Amylsalicylate, slightly more fruity, not as harsh. A faint undertone of ‘“Wintergreen” character."
97,"Pungent-fruity, diffusive, Pineapple-1ike, sweet odor."
98,"Extremely penetrating, pungent and stinging odor."
99,"Mild, herbaceous-fruity odor with a faint green note."
100,"Vinous-fruity, fatty and powerful Banana- Pineapple type odor with Coconut-like background. Also reminiscent of Peach and Mango."
101,"Fatty, Coconut-Pineapple type odor, powerful Rum-like background, reminiscent of Rum-residue, heavy, oily-sweet"
102,"Powerful winey-fruity, “fermented”, Applelike odor."
103,"White crystals of Vanillin-like odor, somewhat weaker than Vanillin, but also more naturaI Vanilla-like."
104,Arnbrein is an odorless solid material
105,"rich and extremely tenacious floral-musky, sweet odor."
106,"Faint, musky odor, weaker than Ambrelto-lide"
107,"Faint, musky odor, weaker than Ambret{olide."
108,"The title materials are bridly mentioned in this work because of their potential interest to the perfumer. “They are natural components of Ambregris, and they are considered of major importance to the olfactory properties of natural Ambregris and Ambre~is tincture."
109,"Heavy-sweet, somewhat animal-floral odor of considerable tenacity, faintly reminiscent of tobacco leaf odor."
110,"In the dry state, this chemical has only a very faint caramellicsweet odor."
111,Practically odorless in the dry state.
112,"Virtually odorless when pure. Commercial products often have a slightly sweet-musty, bland odor."
113,"Strong odor of Ammonia,"
114,Strong aqueous solutions and heated crystals show odor of Ammonia.
115,"Powerful and very diffusive, volatile odor. Violent chemical reaction upon mucous membranes."
116,used in flavors
117,Its strong odor is mainly due to decomposition which takes place even at room temperature.
118,"The compound material has a sharp, cheesy, but also somewhat sweet odor and taste."
119,"Pronounced fruity-fresh odor, sweet but slightly nauseating. In dilution reminiscent of Pear, Banana, Apple. Very volatile."
120,"Powerful and diffusive, fruity, Banana-like odor, also resembling ‘“overripe Pears”."
121,"Fresh-minty, fruity odor, not quite as sweet as the common iso-Amyl acetate."
122,"Fruity-fresh, somewhat green odor, reminiscent of Apples, not quite as sweet as the odor of the iso-Amyl acetate."
123,"Ethereal-fruity, somewhat green-herbaceous, winey-sweet odor."
124,"Peculiar green-leafy, “foliage” type odor, not as “fatty” as Octanal."
125,"Somewhat harsh, chemical odor, reminiscent of Fusel oil, but not as heavy, however, more penetrating, nauseating, cough-provoking. Only in high dilution fairly pleasant."
126,"Choking, disagreeable, cough-provoking, somewhat alcoholic odor, only in high dilution becoming pleasant, fruity-winey."
127,"Winey-ethereal, rather choking odor, somewhat drier than that of commercial 4’Amyl alcohol”."
128,"Unpleasant Ammonia type odor with a decay-like, “decomposition”’ odor."
129,"Warm-herbaceous, yet refreshing-ethereal odor with winey-fruity undertones."
130,"Mild, sweet floral odor reminiscent of Heliotrope, fresh, soft, agreable and very tenacious."
131,"Fruity-Plum-like, Ambre-Neroli type of odor"
132,"Balsamic, mild, sweet, slightly musky Ambre- type odor. Fruity cloverlike background. Quite tenacious."
133,"Peculiar green-floral, sweet and somewhat herbaceous odor of good tenacity."
134,Sweet and somewhat honey-like odor of good tenacity.
135,"Floral-fruity odor, somewhat greener, more herbaceous than Benzyl acetate, and much more tenacious. Overall more Gardenia-like, less Jasmin-like."
136,"Strong ethereal-fruity odor, reminiscent of Apricot, Banana, Pineapple."
137,"Powerful and diffusive fruity, sweet Apricot-Banana-Pineapple-like odor, somewhat sharper than that of the iso-Amyl-iso-buty rate."
138,"Fruity-Apricot-Pineapple type odor, softer and sweeter than that of the iso-Amyl-n-butyrate."
139,"Fruity, heavy-sweet, diffusive odor, reminiscent of Banana and Peach."
140,"Musky, Ambregris-like odor with an oilyfatty note."
141,"Oily-winey, brandy-like odor with mild fruity undertones."
142,"Pungent-fruity, yet refreshing odor, reminiscent of Pineapple, Apple, and remotely of Pear."
143,"Somewhat sharp, Apple-Banana-Pineapplelike odor."
144,"Sweet-oily, fruity odor with distinct “perfumey” floralness: Orris-Elderflower notes, under a Banana-like topnote."
145,"Peculiar oily-fruity, slightly animal odor reminiscent of Elderflower, with orris undertones."
146,practically odorless.
147,"Faintly balsamic, mild Ambre-like, Cocoabean-like (fresh beans), with undertones of Orchid-Labdanum, slightly animal and very tenacious odor."
148,"Very mild, oily-waxy-floral, sweet and pleasant, tenacious odor."
149,"Very mild oily -herbaceous and somewhat floral odor, reminiscent of many types of natural flowers, but mostly of Jasmin, Gardenia and Tuberose."
150,"Warm-oily, herbaceous odor, less floral, but warmer than n-Amy lcinnamic aldehyde, Its lower boiling point results in a poorer tenacity and a somewhat less delicate initial note."
151,"Practically odorless when pure, but may introduce mild-herbaceous, oily-green and slightly vinous notes when used as a modifier of the Aldehyde or its lower Acetals."
152,"Faint and rather nondescript odor, somewhat herbaceous and oily-green, overall nonfloral. Apparently weak, but quite tenacious."
153,"This acetal is described as having a Caraway- type odor, but the author does not quite agree, since he finds only a very mild, warmherbaceous, almost floral-green odor with a trace of spicy undertones."
154,"Faintly oily, green-leafy and simultaneously floral odor, reminiscent of the herbal-floral part of Jasmin. Good tenacity."
155,"Peculiar animal-green odor, mild and reminiscent of parts of the Jasmin complex, although not very floral unless composed with related Jasmin chemicals."
156,"Oily -herbaceous, somewhat green-balsamic odor, not very characteristic of any natural material"
157,"Sweet-floral, predominantly Orangeblossom-like odor with oily -herbaceous undertones, reminiscent of Honeysuckle, Gardenia, Tuberose, remotely of Jasmin and other heavy florals."
158,Mild oily -fruity and somewhat green odor with balsamic and faintly floral undertones.
159,"Oily-herbaceous, sweet and slightly green balsamic odor with some resemblance to Butter caramel."
160,"Peculiar herbaceous-green, somewhat earthy- nutlike odor."
161,"Mild fruit y, somewhat herbaceous-tobaccolike odor."
162,"Very faint odor, vinous-herbaceous type."
163,"Powerful, sweet and fruity odor of moderate tenacity. The fruity notes are rather nondescript, or they may be classified as remotely resembling Raspberry-Banana type."
164,"Powerful, sweet-fruity odor of Banana- Pineapple-Pear type, but far from being a “natural”’ odor. Moderate to good tenacity."
165,"Dry, pine-woody odor of good tenacity, yet of considerable diffusive power."
166,"Very powerful, diffusive, woody-camphoraceous odor, slightly earthy, yet with some resemblance to Orris root, overall very dry."
167,"Camphoraceous, balsamic-green and somewhat sweet odor, reminiscent of certain Pine needle oils, and with good tenacity. Its woody undertones makes it compatible with Patchouli oil, making the overall odor drier."
168,"Fruity, fresh-floral and Jasmin-like odor, but it lacks the “bread-like” note of the Jasmine, a note found in cis-Jasmone and in the Methyl jasmonates. The odor of Amyl cyclopentenone is not as rich as the odor of the named materials."
169,"Pecidiar faint odor, yet choking-nauseating when concentrated. Ethereal without being winey, green but not natural. Has a slightly metallic undertone. In dilution remotely reminiscent of Pear."
170,"Sweet-spicy, somewhat herbaceous-floral, heavy odor of considerable tenacity"
171,"Heavy-sweet, balsamic-floral and very faintly spicy odor of exceptional tenacity."
172,"Powerful ethereal-vinous, somewhat dry-earthy, yet fruity odor with earthy-green undertones."
173,"Peculiar green-fruity, deep-sweet odor, almost nauseating undertone. Ethereal-volatile (diffusive) apple-winey topnote. Resembles also Blackcurrant and Plum."
174,"Sweet-buttery, fruity and caramel-like odor, rather heavy, but also natural and pleasant in high dilution."
175,"Sweet -green, somewhat floral odor with a distinctly fruity note, sweet-caramellic undertone."
176,"Sweet-herbaceous, floral, somewhat spicy- Ambre-like odor of good tenacity."
177,"Heavy, pungent, sweet-fruity odor, remi- niscent of Pineapple, Rum, fruit preserves, wine, etc. with a herbaceous-floral undertone."
178,"Sweet-caramellic-winey, “fermented” odor."
179,"Sweet-fruity, caramellic and somewhat floral odor."
180,"Mild, herbaceous-winey, remotely floral odor of moderate tenacity."
181,"Powerful, but also sweet-leafy-green odor, closely resembling the odor of crushed Violet leaves. Less pungent, and less fatty than the lower alkyl heptin carbonates."
182,Mild citrusy-waxy odor with a faintly fruity note reminiscent of Banana pulp (the nonethereal note) or Peach (the dry note).
183,"Peculiar oily-green, dry-fruity odor."
184,"Peculiar green-fruity, somewhat grassy odor, reminiscent of Bananas and unripe fruits."
185,"Oily-green, herbal odor, reminiscent of fresh-cut flowers stems, rather bitter-green, but refreshing and natural."
186,"Mild, faint, oily -herbaceous odor, sweet and tenacious, like green wood"
187,"Faint, oily-floral, also somewhat herbaceous-green odor, overall very mild and bearing some similarity to the odor of Amylcinnamic aldehyde diethylacetal."
188,"Fruity-winey, somewhat ethereal odor with caramellic undertone."
189,"Rather sharp, fatty-fruity and sweet odor, reminiscent of Apricot and Orange."
190,Very mild oily -winey odor. To some people virtually odorless.
191,"Its odor is extremely faint, oily-fatty, dependent upon the quality of the parent Laurie acid."
192,"Warm, winey-carameliic odor of good tenacity."
193,"Mild, fruity odor with a somewhat greenherbaceous undertone."
194,"Extremely penetrating, unpleasant odor, typical of the mercaptans, sulfuraceous, choking, gassy."
195,"Powerful ethereal, pungent, fruity-apple- Iike very diffusive odor. Somewhat choking, remotely reminiscent of Pineapple."
196,"Fruity, somewhat green, but ak.o sweet and tenacious odor, remotely reminiscent of Strawberry, with a “cooked” note, almost caramellic."
197,"Very mild, waxy odor, to some persons it is absolutely odorless."
198,"Ethereal-fruity, vinous odor with a peculiar musty undertone, rather typical of many alkyl nitrates."
199,"Extremely diffusive, ethereal-fruity, penetrating odor."
200,"Somewhat nutty-oily, fruity-vinous, Apricotlike odor with a faint floral background, remotely rosy."
201,"Powerful green foliage odor, less pungent and less sharp than the Methyl heptin carbonate, and not as fatty, overall more “oily”, yet pleasant."
202,"Very faint “oily” odor, varying with the quality and age of the material."
203,"Virtually odorless when pure, this ester may have a trace of an odor, depending upon its quality."
204,"Sharp and pungent green foliags type odor, almost choking-gassy in the pure state, more pleasant at concentrations below 0.1 ‘?Oin an odorless solvent."
205,"Very dry “phenolic” - medicinal odor, sometimes described as “’leatherlike”, but more appropriately “tanning-odor”."
206,"Heavy green, “twig-like” odor, also bark- or sap-like with a fruity undertone."
207,"Peculiar fruity-green, more grassy, less woody odor, as compared to the aldehyde itself. Much sweeter, not near] y as dry or harsh."
208,"Sweet and very tenacious, musky-animal odor with a fruity -balsamic undertone reminiscent of (fresh) Cocoa beans."
209,"Peculiar earthy-floral, somewhat camphoraceous and rather dry odor, remotely reminiscent of Rose and Hyacinth."
210,"Powerful Rose-Hyacinth-like odor, somewhat earthy-green, not really pleasant in the pure state, but quite attractive and interesting when diluted."
211,"Sweet and somewhat floral odor of great tenacity. Faintly reminiscent of Amyl ‘salicylate, but more haylike-herbaceous."
212,no information
213,"Very sweet-fruity, Apricot-Pineapple type odor with a somewhat harsh overtone and considerable radiance"
214,"Herbaceous and green-spicy, fairly tenacious odor, reminiscent of vegetables and condiments."
215,"Sweet-herbaceous, slightly floral tobacco- Iike note, somewhat reminiscent of Elderflow - ers (animal undertones)."
216,"Sweet and somewhat floral odor, not without a note of animal, amine-like character. Overall less pleasant than many Alkyl pyridines"
217,Fresh ethereal caramel-Rum-like odor with fruity-floral undertones.
218,"Sweet herbaceous-green, slightly floral odor. Very tenacious, somewhat woody-earthy, sweet dryout notes. Refined qualities of this ester may show a marked difference in odor, particularly richer in sweetness and floral tones."
219,"Very faint waxy-fatty odor, or practically odorless."
220,"Virtually odorless, useful as a solvent, but does not seem to offer significant advantages over the much less expensive Diethyl phthalate."
221,"Pleasant, mild, aromatic odor, suggestive of Gooseberry with a Grape-like, winey undertone, but overall weak."
222,"Very faint odor, remotely reminiscent of Brandy, nondescript fruity"
223,"Dry-woody, somewhat camphoraceous odor."
224,"faint, but pleasant aromatic- herbaceous odor, remotely reminiscent of Amyl acetate."
225,"Herbaceous-winey, overall pleasant odor reminiscent of sweet medicinal herbs (meadowlike odor). The odor bears quite some resemblance to that of the -angelate."
226,"Oily-rosy odor with vinous-brandylike undertone, overall mild and by some observers described as “odorless”."
227,"Somewhat fatty-green, oily and fruity, Apricotlike odor with a faintly floral (Rose) undertone. pronounced brandy like, winey herbaceous in high dilution, but becomes rather unpleasant, almost “rubberlike”’ at high concentrations."
228,"Fruity-ethereal, heavy, Apple-like odor, not as fresh-druity as the iso-Amyl-iso-valerate."
229,"Peculiar fruity odor reminiscent of ripe apples, or more like the overwhelmingly choking odor of apples stored in a warehouse, almost a “fermented” apple odor."
230,Very faint balsamic-animal odor with floral undertones.
231,"Very powerful, sweet-earthy, almost buttery and fungus- or fermentation-like odor with a strong herbaceous note, -suggestive of Lavender- Lavandin-Rose and Hay."
232,"Fresh-herbaccous, fruity -minty odor, recalling the topnotes in Lavender and Lavandin (and many other herbaceous essential oils) less warm and not buttery as the alcohol, more citrusy, and almost geranium-like in topnote. Some observers find a rosy note in this ester."
233,"Fruity -herbaceous, almost haylike-sweet odor, recalling topnotes in Lavender-Clary Sage. Less Lavandin-like, more Lavender- Clary-Sage-like than the Acetate, and also sweeter-warmer."
234,See comments under monograph : Androstenone
235,Reported as having a penetrating urine-like odor
236,"Very sweet, herbaceous-wrarm odor, sweet taste. It is the prototype of odors described as “anisic”."
237,"Pleasant, sweet-herbaceous odor, perhaps less sweet than Anethole, but with a freshness instead."
238,"Peculiar spicy -caramellic, slightly acid odor."
239,"lts intensely sweet-herbaceous, almost tobacco-like odor makes this chemical interesting for application in new fragrance types."
240,"When absolutely pure, this material has a warm, sweet and actually pleasant odor - in suitabie dilution. Commercial grades are often unsuitable for smelling because of traces of very ill-smelfing Amines and other off-odors, by-product, etc."
241,"Intensely sweet floral, yet somewhat “hayIike” odor, generally described as HawthorneIike."
242,"This Acetal has an odor distinctly different from that of the parent aldehyde, and the Acetal is much weaker of odor,"
243,"Herbal-green, somewhat floral odor, suggestive of Lilac (“Lilac-green’”), Hyacinth, Appleblossom, etc."
244,"Heavy-sweet, intensely floral odor with fruity undertones. Resembling the odor of the flowers of Robinia pscudoacacia, remotely resembling notes in Gardenia (fruity-Peachlike notes)."
245,"Practically odorless when pure, this chemical may carry some odor from the starting material (Anethole, or other)."
246,"Powerful and harsh, yet very sweet odor, rather chemical and not reminiscent of any natural material, except perhaps remotely of Anise, Its odor is often classified as “anisic”, but the author finds that this term would not be used by perfumers."
247,"Mild fruity-floral, slightly balsamic-vanillialike odor in the Plum and Lilac type, also reminiscent of certain types of Cherry."
